{
  "$schema": "https://json-schema.org/draft/2020-12/schema",
  "$id": "https://schemas.intelliger.ai/oati/v1/passport.schema.json",
  "title": "OATI Agent Passport",
  "type": "object",
  "additionalProperties": false,
  "required": ["oati_version", "id", "organisation_id", "issuer", "status", "issued_at", "expires_at", "verification_methods"],
  "properties": {
    "oati_version": { "const": "1.0" },
    "id": { "type": "string", "pattern": "^oati:agent:[A-Za-z0-9._:-]+$" },
    "organisation_id": { "type": "string", "pattern": "^oati:org:[A-Za-z0-9._:-]+$" },
    "issuer": { "type": "string", "minLength": 1 },
    "status": { "enum": ["active", "suspended", "revoked", "expired"] },
    "display_name": { "type": "string", "maxLength": 200 },
    "capabilities": { "type": "array", "items": { "type": "string" }, "uniqueItems": true },
    "protocols": { "type": "array", "items": { "enum": ["http", "grpc", "mcp", "a2a"] }, "uniqueItems": true },
    "assurance_level": { "type": "string" },
    "verification_methods": {
      "type": "array",
      "minItems": 1,
      "items": {
        "type": "object",
        "additionalProperties": false,
        "required": ["id", "type", "controller", "public_key_jwk"],
        "properties": {
          "id": { "type": "string" },
          "type": { "type": "string" },
          "controller": { "type": "string" },
          "public_key_jwk": { "type": "object" }
        }
      }
    },
    "issued_at": { "type": "string", "format": "date-time" },
    "expires_at": { "type": "string", "format": "date-time" },
    "status_endpoint": { "type": "string", "format": "uri" },
    "proof": { "$ref": "#/$defs/proof" }
  },
  "$defs": {
    "proof": {
      "type": "object",
      "required": ["type", "created", "verification_method", "signature"],
      "properties": {
        "type": { "type": "string" },
        "created": { "type": "string", "format": "date-time" },
        "verification_method": { "type": "string" },
        "signature": { "type": "string" }
      }
    }
  }
}
